sentence,page,topic,similarity
"日立のさらなる成長を実現する「Value Creation」、それを支える「Business Sustainability」、そして、企業価値創出の源泉である「Corporate Governance」
の3つのパートで構成しています。",3,健康と安全,0.3124
"他社にない社会イノベーション事業の強みをつくるためにはデジタル化の加速が不可欠と考え、2016年に
「Lumada 」を立ち上げました。",8,健康と安全,0.3097
"DX、GXの追い風を生かしたトップライン成長、Lumada事業の拡大による利益率向上、リスクマネジメント
強化 による当期利益の安定化、そして最も重視しているキャッシュ創出力 の強化に取り組んできました。",8,健康と安全,0.3032
"日立は、このような社会課題
を解決すべく、生成AI時代に沿った、IT×OT×プロダクトを活用したOne Hitachiでのソリューションを展開していきます。",10,健康と安全,0.3235
"これからのリーダーに求められる役割は、One Hitachiでのチーム戦を世界中で展開するために、従業員一人一人がもつそれぞれの「ワクワク
すること「」やりたいこと」を一つの強いエネルギーにすることです。",12,エネルギー,0.3673
"そして、社会イノベーション事業の基盤となるデジタル技術や ンの創出（PLAN：右上）から始まり、IT×OT×プロダクトを組み合わせたソリューションの実装
ナレッジ、ビジネスモデルなどを結集した仕掛け・仕組みがLumada です。",14,健康と安全,0.3146
"これまでに日立エナ システム開発の分野 では、ミッションクリティカルなシステム開発の知見と生成AIとを組
ジー、日立レール、GlobalLogic、Hitachi Vantara、Hitachi Digital Services各社CEOを み合わせ、高い品質を確保しながらシステム開発の生産性向上に取り組んでいます。",15,健康と安全,0.3078
"2024年度からは、日立デジタル やプロダクトのナレッジやデータと生成AIをかけ合わせ、フロントラインワーカーの生産性向
やGlobalLogic、Hitachi Digital 上に向けた取り組み も始めています。",15,健康と安全,0.3571
"さらに、NVIDIA DGX BasePOD™の認定を取得した
的なデジタルソリューションを、Hitachi Vantara、Hitachi Digital Servicesによる高信頼・高効 「Hitachi iQ 」を新たに開発し、生成AI基盤の強化も継続的に推進しています。",17,健康と安全,0.3572
"また、データセンターなどの 国初となる完全自動運転都市鉄道システムをホノルルで運行開始 し、ボルチモアをはじめと
新たな成長セグメントへの進出においては、DSSセクターと協業し、さらなる製品・サービスの した各都市への鉄道システムの納入を進めています。",19,健康と安全,0.3518
"また、新たな成長軌道に向けて、高成長の製造・ヘルスケア・ 「産業系プロダクト＋ターゲット市場向けインテグレーション」の強化で Lumada 事業を拡大
サービス分野に投資を集中していきます。",21,健康と安全,0.3907
"安全安心な モビリティ、セキュリティ分野などのソリューション提供を通じて、
社会づくりに貢献 人々の快適で活動的な生活の実現に貢献します。",23,健康と安全,0.5533
"社会環境の変化およびステークホ 豊かな人生に貢献 未来をより大きく花開かせる大地であるという思いから、従業員
の幸せとウェルビーイングの実現を追求し続けます。",23,健康と安全,0.3266
"生き生きと活躍できる お互いを尊重し、あらゆる違いに価値を置くことを通じて、市
ナビリティへの取り組みをグループ全体で推進しています。",23,生物多様性の損失,0.3065
"生き生きと活躍できる お互いを尊重し、あらゆる違いに価値を置くことを通じて、市
ナビリティへの取り組みをグループ全体で推進しています。",23,健康と安全,0.3051
"生き生きと活躍できる お互いを尊重し、あらゆる違いに価値を置くことを通じて、市
ナビリティへの取り組みをグループ全体で推進しています。",23,平等と機会,0.3005
"ネジメントのトップダウンと従業員からのボトムアップに加え、地域および年齢横断的な複数の
2050年度までにバリューチェーンを通じてカーボンニュートラル達成という目標は日立1社では アプローチが重要となります。",25,生物および食料資源の汚染,0.3398
"社会課題の解決にはテクノロジーの進化が不可欠ですが、生成AIの出現やそれに伴う電力需 組織横断のOne Hitachiでのサステナビリティへの取り組みや投資は、中長期的なリターンの
要の増大など、大きな社会変化への対応も必要です。",25,気候変動への適応,0.3218
"社会課題の解決にはテクノロジーの進化が不可欠ですが、生成AIの出現やそれに伴う電力需 組織横断のOne Hitachiでのサステナビリティへの取り組みや投資は、中長期的なリターンの
要の増大など、大きな社会変化への対応も必要です。",25,健康と安全,0.315
"そのために日立は、マテリアリティ評価を 向上や、リスク低減による資本コストの低減にもつながり、日立全体のイノベーションの創出や
継続的に見直すことでサステナビリティへの対応力を高めます。",25,健康と安全,0.3007
"テクノロジーを活用し、データを用いた経営および事業運営の効率化
また、テクノロジーの進化とサステナブル社会を両立するためには、バリューチェーン全体へ に加え、サステナビリティ開示基準への対応を含む透明性の確保にも取り組んでいきます。",25,健康と安全,0.3513
取り組みの一例として、One Hitachi コラボレーション・ワークショップ*1 が挙げられます。,27,労働時間,0.3262
"後は①キャッシュ創出力の強化、②規律ある成長投資の支援、 コアFCFの増加に関する4つのKPIとして「売上成長「」利益
③成長と還元においてバランスの取れたキャピタルアロケー 率「」キャッシュ効率「」CFPS成長」を設定しています。",28,健康と安全,0.3335
"この結果、1株当たりのコアFCFであ 拡大と事業ポートフォリオ見直しによる向上に加え、デジタル
るCFPSが年率で22%成長する見込みとなっています。",29,健康と安全,0.3015
"ROIC（Return on Invested Capital、投下資本利益率）10％
ています。",29,生物および食料資源の汚染,0.3105
"日立では執行役社長兼CEOを議長、CRMO（Chief Risk Management 日立は2021年2月にAI倫理原則を定め、AI倫理の観点からリスク管理を図るAIガバナンス
Officer）を 副議長とした「リスクマネジメント会議」において、事業環境を定量面・定性面から の仕組みの整備を推進しています。",32,健康と安全,0.3212
2024年度からブリス・コッホ執行役副社長がCSO（Chief Strategy Officer）と 守るとともに、社会イノベーション事業のグローバル成長を加速します。,32,健康と安全,0.3031
"CRMOを兼務し、各地域の成長機会を取り込んだ全社の地域戦略とグローバルリスクを捉えた 本ポリシーの定着に向け、グループガバナンスの状況や課題の見える化を各BUにて行うため
経営戦略の両輪で、One Hitachiでのグローバル成長を加速していきます。",32,気候変動への適応,0.3023
"CRMOを兼務し、各地域の成長機会を取り込んだ全社の地域戦略とグローバルリスクを捉えた 本ポリシーの定着に向け、グループガバナンスの状況や課題の見える化を各BUにて行うため
経営戦略の両輪で、One Hitachiでのグローバル成長を加速していきます。",32,健康と安全,0.3075
"重大リスクテーマごとに平時から準備体制を構築し、有事の際の態勢や対応の スクと機会）の変化に対応して、投融資等案件の実行判断基準および実行後のPMIやモニタリン
整備を推進しています。",33,気候変動への適応,0.3357
"投融資等実行時 日立は2018年6月に金融安定理事会（FSB「）気候関連財務情報開示タスクフォース（TCFD）」
は、取締役会、経営会議、BUの３階層での審議体制の中で、案件規模やリスク内容に応じて権限 の提言に賛同を表明しました。",33,気候変動への適応,0.3236
"さらに生成AIのような新領域の事業機会を獲得し、
の視点で取締役の候補者リストを作成・定期的に見直しし、指 能力が今後のCEOに求められています。",36,平等と機会,0.3157
経験やスキルは当 さらに、成長のエンジンとなる取締役・執行役の報酬制度 アンスとリスク管理が求められることも認識しています。,36,健康と安全,0.3227
経験やスキルは当 さらに、成長のエンジンとなる取締役・執行役の報酬制度 アンスとリスク管理が求められることも認識しています。,36,平等と機会,0.3452
"基本報酬および株式報酬の基準額の
日立は、在任時からの株式保有を通じて経営陣の株主との価値共有を一層高めることで、中長期視点 比率は、３：１を基本型とします。",40,平等と機会,0.3031
"今後も日立は、役員および従業員双方において、企業価値の向上と報
酬を連動させて成長へのマインドを醸成し、One Hitachiでグローバルな成長を実現していきます。",40,健康と安全,0.3378
"今後も日立は、役員および従業員双方において、企業価値の向上と報
酬を連動させて成長へのマインドを醸成し、One Hitachiでグローバルな成長を実現していきます。",40,平等と機会,0.3102
"● Pay-for-Performance の徹底による 2 成長マインドの醸成に資する報酬体系と業績評価体系の確立
企業価値の伸長の実現 「●成長「」収益性向上「」キャッシュ創出」について短期的な成果と中長期的な成果の最適バランスを追求し、短期の成果と中長期的な企業価値の向上の両立をめざします。",40,健康と安全,0.3131
開催日数 9日 もに、経営幹部や現場の従業員との対話の機会を設けました。,42,生物および食料資源の汚染,0.3284
開催日数 9日 もに、経営幹部や現場の従業員との対話の機会を設けました。,42,平等と機会,0.3134
"2023年度の事業所（ファクトリー・オフィス）におけるCO2排出
*3 日立から他社への出向者および休職者を含め、他社から日立への出向者を除いた在籍人員数（3月末時点）に基づく 量は、数値に非エネルギー起源の温室効果ガス（kt-CO2e）を含めています。",48,労働時間,0.3183
"2023年度の事業所（ファクトリー・オフィス）におけるCO2排出量、水使用量
* * 4 5 例 自 年 己 、 都 設 合 問 退 の 職 一 者 部 の 変 み 更 対 あ 象 り。",48,空気の汚染,0.3632
"2023年度の事業所（ファクトリー・オフィス）におけるCO2排出量、水使用量
* * 4 5 例 自 年 己 、 都 設 合 問 退 の 職 一 者 部 の 変 み 更 対 あ 象 り。",48,水の汚染,0.403
"2023年度の事業所（ファクトリー・オフィス）におけるCO2排出量、水使用量
* * 4 5 例 自 年 己 、 都 設 合 問 退 の 職 一 者 部 の 変 み 更 対 あ 象 り。",48,生物および食料資源の汚染,0.318
"2023年度の事業所（ファクトリー・オフィス）におけるCO2排出量、水使用量
* * 4 5 例 自 年 己 、 都 設 合 問 退 の 職 一 者 部 の 変 み 更 対 あ 象 り。",48,水の消費と取水,0.4123
